{
  "site_id": "SWE-001",
  "region": "Southwest Ethiopia Peoples' Region",
  "zone": "Bench Sheko",
  "woreda": "Example Woreda",
  "area_ha": 1287.5,
  "land_cover_primary": "cropland_tree_mosaic",
  "land_cover_mix": {
    "tree_cover": 0.18,
    "cropland": 0.52,
    "grassland": 0.17,
    "built_up": 0.04,
    "water": 0,
    "other": 0.09
  },
  "ndvi_current": 0.43,
  "ndvi_trend_5y": -0.06,
  "evi_current": 0.31,
  "forest_loss_score": 76,
  "rainfall_mean_mm": 1120,
  "rainfall_reliability_score": 78,
  "slope_mean_deg": 18,
  "slope_risk_score": 82,
  "soil_organic_carbon_score": 67,
  "soil_ph_suitability_score": 72,
  "population_pressure_score": 78,
  "road_access_score": 69,
  "settlement_proximity_score": 70,
  "protected_area_overlap_pct": 0,
  "safeguard_risk_score": 18,
  "data_quality_score": 73,
  "field_validation_required": true,
  "feature_version": "v0.1"
}
